Recipe ID,Food Item Name,Ingredients
654371,Palak Gosht,"fry onion till golden brown, chillies nos, coriander bunch, garlic pod, ginger long 2 inch, then add water i and cook on flame till meat is tender, add meat and fry, oil, onion nos, serve, delicious palak gosht is ready, spices: salt, tomatoes nos, boil palak in water, mutton, now add palak and cook, palak, mutton, now add palak and cook, palak"
663669,Tonkatsu,"egg, flour, tonkatsu sauce, panko bread crumbs, pepper, pork chops, salt, vegetable oil"
648500,Japanese Steak Salad,"well-trimmed beef top sirloin 3 cups napa cabbage, carrots, rice, cucumber, sherry, ginger, green onion, hoisin sauce, soy sauce, oriental roasted sesame oil, pea pods, radishes, rice wine vinegar, romaine lettuce, sugar, water"
652542,Mughlai Malai Kofta Curry,"chilli powder, thai chillies, coriander powder, cornflour/ corn starch, cilantro, garam masala, garlic paste, ginger paste, golden raisins, chillies, cream / half & half, cmin powder, % milk, onions, paneer, paneer, carrot & peas, potatoes, salt, tomato puree, turmeric powder, shah jeera"
664551,Vegetable Fried Wontons,"scallion, jicama, carrot, celery, ginger, garlic, soy sauce, oyster sauce, honey, rice wine, chicken broth, wonton wrappers, canola oil, cinnamon, sauce"
664861,Curry Spiced Carrots,"carrots - tops and carrots, cilantro, curry powder, garlic cloves, kosher salt and pepper, lemon juice, lime wedges, olive oil, greek yogurt, turmeric"
654072,Oriental Filet Mignon on Crisp Kataifi with Shrimp Tempura,"filet mignon steaks, wine, each: soy sauce, ginger, garlic, pepper flakes, rice vinegar, water shrimp, egg whites, corn starch, panko, kataifi pastry, oil"
647799,Indian Butter Chicken,"butter, chicken breasts, chicken broth, garam masala, garlic, ginger, lemon, oil, yogurt, salt and pepper, cream, tomatoes"
645961,Indian-Spiced Ground Beef Main Dish,"canola oil, chilli powder, cilantro, cinnamon stick, mint leaves, spinach, garam masala, garlic glove, ginger paste, cardamom pods, chillies, ground beef, ground cumin, ground pepper, onion, yogurt, salt"
648467,Japanese Cucumber Salad,"cucumber, green onions, rice wine vinegar, sesame oil, soy sauce, pkt sugar substitute"
660959,Spiced Lassi,"yogurt, water, chilli, shallot, roasted cumin seeds, corriander leaves, salt, ice cubes"
658967,Saffron Chicken Tikka,"chicken breasts, cinnamon stick, cardamom seeds, cardamom seeds, cloves, chillies, garlic paste, ginger paste, pepper corns, saffron, milk, salt, skewers, skewers"
667701,salmon fried rice,"brown sugar, cilantro, eggs, garlic, ginger, green onions, olive oil, peas, bell pepper, onion, day old rice, salmon in chunks, soy sauce"
648487,Japanese Pickles,"chili peppers, japanese cucumbers, cilantro, onion, rice syrup, rice vinegar, salt"
1681409,Avocado Sweet Lassi - How to make Avocado Lassi - Indian Avocado,"avocado, yogurt, to .5 cups water, cardamom powder, sugar"
